Summit Creek,,68.5,59.2,2,1,"Greenwood, 2010, How wet was the Arctic Eocene rain forest? Estimates of precipitation from Paleogene Arctic macrofloras; Bell, 2018, Biostratigraphy of Cretaceous and Paleogene Strata from Northern Yukon Territory and District of Mackenzie, Northwest Territories",Terrestrial,Palynology,Not hugely well constrained. Precise ages not possible.,NWT,,
Tango Creek,Tatlatui,83.5,66,5,5,"Bustin and McKenzie, 1989, Stratigraphy and depositional environments of the Sustut Group, southern Sustut Basin, north central British Columbia. Bulletin of Canadian Petroleum Geology, 37(2), 210-223; Arbour and Evans, 2019. A new leptoceratopsid dinosaur from Maastrichtian-aged deposits of the Sustut Basin, northern British Columbia, Canada. PeerJ, 7, 7926; Arbour et al. 2020. Cretaceous flora and fauna of the Sustut Group near the Sustut River, northern British Columbia, Canada. Canadian Journal of Earth Sciences, 57(6), 671-680.",Terrestrial,Palynology,"No well refined ages for this member - whole formation extends from Albian-Maastrichtian. Precise dates available for site of vertebrate material based on Palynology, equating to approx. 68.2-67.2 Ma.",NWT,,
Tar Heel,,83.5,77.1,0.5,0.5,"Slef-Trail et al., 2004, THE AGE OF DINOSAUR-BEARING STRATA AT PHOEBUS LANDING, CAPE FEAR RIVER, NORTH CAROLINA; Harris and Self-Trail, 2006, Late Cretaceous base level lowering in Campanian and Maastrichtian depositional sequences, Kure Beach, North Carolina; Longrich, 2016, A ceratopsian dinosaur from the Late Cretaceous of eastern North America, and implications for dinosaur biogeography",Terrestrial/shallow marine,Radiometric dating,,EC,,
Tornillo,Javelina,69,66,0.5,1,"Leslie et al., 2018, Revised age constraints for Late Cretaceous to early Paleocene terrestrial strata from the Dawson Creek section, Big Bend National Park, west Texas; Lehman et al., 2018, Stratigraphy and depositional history of the Tornillo Group (Upper Cretaceous–Eocene) of West Texas",Terrestrial,"Magnetostratigraphy, biostratigraphy","NOTE: Same as Javelina formation. grouped into Tornillo by Standhardt (1986). Currently under revision - Black Peaks ma not fall within Cretaceous at all. As such, all dinosaur remains would be part of the underlying Javelina formation. Leslie et al. (2018) identified as between C31 and Cr29. However, Lehman et al. (2018) claim that nearby dinosaur remains disregard this correlation. ",GC,,
Tropic Shale,,93.99,90.51,0.5,0.5,"Titus et al., 2005, Late Cretaceous stratigraphy, depositional environments, and macrovertebrate paleontology of the Kaiparowits Plateau, Grand Staircase–Escalante National Monument, Utah",Marine,"Radiometric dating, biostratigraphy",From Vascoceras diartianum to Prionocyclus hyatti,WI,,
Turney Ranch,,110,98,1,1,"D'Emic et al., 2016, Anatomy, systematics, paleoenvironment, growth, and age of the sauropod dinosaur Sonorasaurus thompsoni from the Cretaceous of Arizona, USA",Terrestrial,"Radiometric dating, stratigraphy",,WC,,
Twin Mountains,,126.3,108.5,1,5,"Winkler et al., 1990, Early Cretaceous (Comanchean) Vertebrates of Central Texas; Axsmith and Jacobs, 2005, The Conifer Frenelopsis ramosissima (Cheirolepidiaceae) in the Lower Cretaceous of Texas:
Systematic, Biogeographical, and Paleoecological Implications",Terrestrial/shallow marine,"Biostratigraphy, stratigraphy","Top constrained by overlying Paluxy Formation. Base not constrained at all - considered Aptian, but could potentially be older. ",GC,,
Two Medicine,,81.5,75.04,0.1,0.5,"Fowler, 2017",Terrestrial,"Radiometric dating, biostratigraphy","Well constrained at both top and base, although both potentially time transgressive.",WI,,
Wahweap,,81,76.5,0.5,1,"Albright and Titus, 2016, Magnetostratigraphy of Upper Cretaceous strata in Grand Staircase-Escalante National Monument, southern Utah: The Santonian–Campanian Stage boundary, reassessment of the C33N/C33R magnetochron boundary, and implications for regional sedimentation patterns within the Sevier Foreland Basin; ",Terrestrial,"Radiometric dating, magnetostratigraphy","Base well constrained, top estimated based on magnetostratigraphy and radiometric dating of above unit (Kaiparowitz)",WI,,
Wapiti,,79.1,67.6,0.4,0.5,"Fanti and Catuneanu, 2009, Stratigraphy of the Upper Cretaceous Wapiti Formation, west-central Alberta, Canada",Terrestrial,"Radiometric Dating, biostratigraphy, stratigraphy",,WI,,
Wayan,,101.8,95.5,4,4.8,"Krumenacker, 2010, Chronostratigraphy and Paleontology of the mid-Cretaceous Wayan Formation of Eastern Idaho, with a Description of the First Oryctodromeus Specimens from Idaho",Terrestrial,"Radiometric dating, biostratigraphy, palynology","Dating imprecise - large variation in potential ages, and noted that formation may be older due to lack of dating formations below.",WI,,
Wenonah/Mount Laurel,,71,69.4,0.5,0.5,"Sugarman et al, 1995, Uppermost Campanian–Maestrichtian strontium isotopic, biostratigraphic, and sequence stratigraphic framework of the New Jersey Coastal Plain",Marine,"Radiometric dating, biostratigraphy",Virtually co-eval with Wenonah formation - vary in proportions across NJ region.,EC,,
Whitemud,,68.2,68,0.1,0.1,"Eberth and Kamo, 2020, High-precision U–Pb CA–ID–TIMS dating and chronostratigraphy of the dinosaur-rich Horseshoe Canyon Formation (Upper Cretaceous, Campanian–Maastrichtian), Red Deer River valley, Alberta, Canada, Canadian Journal of Earth Sciences, 57(10), 1220–1237; Eberth and Braman, 2012, A revised stratigraphy and depositional history for the Horseshoe Canyon Formation (Upper Cretaceous), southern Alberta plains, Canadian Journal of Earth Sciences, 29, 1053-1086; Lerbekmo, 2009, Glacioeustatic sea level fall marking the base of supercycle TA-1 at 66.5 Ma recorded by the kaolinization of the Whitemud Formation and the Colgate Member of the Fox Hills Formation, Marine and Petroleum Geology, 26(7), 1299-1303; Broughton, 2022, Fruit taphonomy and origin of hollow goethite spherulites in lacustrine sediments of the Maastrichtian Whitemud Formation, western Canada, PalZ",Terrestrial,"Biostratigraphy, magnetostratigraphy","Definition of Whitemud is somewhat challening - has now become a member in Alberta, but remains a formation in Saskatchewan. Defined by high Kaolinite contnt - due to straigraphic wandering, has suggested to be a defined time horizon related to weathering of tuffs. Eberth and Kamo (2020) use magnetostratigraphy and biozones to date, following Lerbekmo (2009) who suggested a 200kyr length for this formation. ",WI,,
Williams Fork,,74.21,71.13,2,0.5,"Sullivan and Lucas, 2006, The Kirtlandian land-vertebrate “age”–faunal composition, temporal position and biostratigraphic correlation in the nonmarine Upper Cretaceous of western North America; Ogg and Hinnov, 2012, Chapter 28: The Cretaceous in: The Geologic Timescale; Fowler, 2017",Terrestrial,Biostratigraphy,"Based on ammonite zones (Didymoceras cheyennense to Baculite baculus), with dates changed due to Ogg and Hinnov (2012). Top boundary very unsure - could span longer period of time.",WI,,
Willow Creek,,66.97,64.667,0.1,0.5,"Brahman, 2018, Terrestrial palynostratigraphy of the Upper Cretaceous (Santonian) to lowermost Paleocene of southern Alberta, Canada; Fowler, 2017",Terrestrial,Radiometric dating; magnetostratigraphy,Top taken from Brahman (2018) using updated 28N chron from Ogg and Hinnov (2012). Base taken from radiometric date of Kneehills Tuff. May have slight variability/exhibit disconformity at base.,WI,,
Woodbine,,97.5,95.8,0.5,0.5,"Donovan et al., 2015, Chronostratigraphic relationships of the Woodbine and Eagle Ford Groups across Texas",Terrestrial/shallow marine,"Biostratigraphy, stratigraphy",From Acompsoceras inconstans to Plesiacanthoceras muldoonense,GC,,
Woodbury,,83.6,77.9,0.2,0.2,"Stringer et al., 2016, Woodbury Formation (Campanian) in New Jersey yields largest known Cretaceous otolith assemblage of teleostean fishes in North America",Shallow marine,"Palynology, biostratigraphy",Relatively weak constraint - only at sub-stage level. Potential error taken directly from paper. ,EC,,